{
  "schemaVersion": 3,
  "packId": "practice-v2-ch-37-source-checked-v1",
  "packStatus": "content",
  "chapterId": "ch-37",
  "chapterTitle": "Safety Program Auditing",
  "questions": [
    {
      "id": "PV2-CH37-001",
      "version": 1,
      "chapterId": "ch-37",
      "chapterTitle": "Safety Program Auditing",
      "examAlignments": [
        "ASP",
        "CSP"
      ],
      "blueprintMappings": [
        {
          "credential": "ASP",
          "blueprintVersion": "ASP11",
          "objectiveId": "ASP11-A2.10",
          "role": "primary"
        },
        {
          "credential": "CSP",
          "blueprintVersion": "CSP11",
          "objectiveId": "CSP11-D2.08",
          "role": "secondary"
        }
      ],
      "concept": "Audit versus inspection",
      "itemFamilyId": "CH37-AUDIT-INSPECTION-01",
      "questionType": "single-best-answer",
      "cognitiveLevel": "understand",
      "stem": "Which statement best distinguishes a program audit from a workplace inspection?",
      "options": [
        "An audit is always unannounced while an inspection is always scheduled",
        "An audit evaluates the management system and its effectiveness; an inspection focuses on conditions and practices",
        "An inspection can review documents but an audit cannot",
        "The terms are identical and require the same evidence"
      ],
      "correctOptionIndex": 1,
      "correctAnswerExplanation": "Audits test whether the system is designed, implemented, and effective; inspections more directly identify current workplace conditions.",
      "incorrectOptionExplanations": [
        "Scheduling does not define whether an activity is an audit or inspection.",
        null,
        "Inspections may include records, and audits commonly rely heavily on documents and interviews.",
        "The activities may overlap but have different scope and objectives."
      ],
      "sourceTitle": "Safety Professional's Reference and Study Guide, 4th ed. (W. David Yates, CRC Press, 2025)",
      "sourceLocation": "Yates Chapter 37, purpose and methodology of auditing, pp. 818-825",
      "sourceUrls": [
        "https://doi.org/10.1201/9781003511786"
      ],
      "sourceVerifiedOn": "2026-08-26",
      "formula": null,
      "units": null,
      "reviewStatus": "ready",
      "verificationStatus": "source-checked",
      "authoringOrigin": "ai-assisted",
      "contentValidationStatus": "passed",
      "duplicateSimilarityCheckStatus": "passed",
      "contentFingerprint": "c7dce14eb7f48e98cf04cea13ff11efc9f4fce7b0810300665c85feb042e1d87"
    },
    {
      "id": "PV2-CH37-002",
      "version": 1,
      "chapterId": "ch-37",
      "chapterTitle": "Safety Program Auditing",
      "examAlignments": [
        "ASP",
        "CSP"
      ],
      "blueprintMappings": [
        {
          "credential": "ASP",
          "blueprintVersion": "ASP11",
          "objectiveId": "ASP11-A2.10",
          "role": "primary"
        },
        {
          "credential": "CSP",
          "blueprintVersion": "CSP11",
          "objectiveId": "CSP11-D2.08",
          "role": "secondary"
        }
      ],
      "concept": "Audit independence",
      "itemFamilyId": "CH37-INDEPENDENCE-01",
      "questionType": "single-best-answer",
      "cognitiveLevel": "evaluate",
      "stem": "A department manager selects evidence and removes two adverse findings before the audit report is issued. Which audit principle is most threatened?",
      "options": [
        "Sampling precision only",
        "Training transfer only",
        "Objectivity and independence",
        "Equipment reliability only"
      ],
      "correctOptionIndex": 2,
      "correctAnswerExplanation": "Auditors need freedom to evaluate and report evidence without inappropriate influence from the function being audited.",
      "incorrectOptionExplanations": [
        "Sampling may be affected, but management suppression primarily compromises impartial reporting.",
        "The scenario concerns audit governance, not training application.",
        null,
        "No equipment reliability evidence is described."
      ],
      "sourceTitle": "Safety Professional's Reference and Study Guide, 4th ed. (W. David Yates, CRC Press, 2025)",
      "sourceLocation": "Yates Chapter 37, audit methodology, documentation, and interviews, pp. 818-843",
      "sourceUrls": [
        "https://doi.org/10.1201/9781003511786"
      ],
      "sourceVerifiedOn": "2026-08-26",
      "formula": null,
      "units": null,
      "reviewStatus": "ready",
      "verificationStatus": "source-checked",
      "authoringOrigin": "ai-assisted",
      "contentValidationStatus": "passed",
      "duplicateSimilarityCheckStatus": "passed",
      "contentFingerprint": "478b0da06e492848d46676cdc3534fe5405909ca023cc176c792bb3f712a760f"
    },
    {
      "id": "PV2-CH37-003",
      "version": 1,
      "chapterId": "ch-37",
      "chapterTitle": "Safety Program Auditing",
      "examAlignments": [
        "ASP",
        "CSP"
      ],
      "blueprintMappings": [
        {
          "credential": "ASP",
          "blueprintVersion": "ASP11",
          "objectiveId": "ASP11-A2.10",
          "role": "primary"
        },
        {
          "credential": "CSP",
          "blueprintVersion": "CSP11",
          "objectiveId": "CSP11-D2.08",
          "role": "secondary"
        }
      ],
      "concept": "Audit evidence triangulation",
      "itemFamilyId": "CH37-TRIANGULATION-01",
      "questionType": "single-best-answer",
      "cognitiveLevel": "analyze",
      "stem": "A procedure states that weekly inspections occur, but employees describe monthly inspections and records show long gaps. What should the auditor conclude?",
      "options": [
        "The written procedure alone proves conformity",
        "Employee interviews should always override records",
        "No conclusion is possible unless an injury occurred",
        "The documented procedure is not reliably implemented and the conflicting evidence requires a finding"
      ],
      "correctOptionIndex": 3,
      "correctAnswerExplanation": "Triangulating documents, interviews, records, and observations tests both system design and actual implementation.",
      "incorrectOptionExplanations": [
        "A document describes intent; implementation requires corroborating evidence.",
        "Interviews are one evidence source and should be weighed with records and observations.",
        "Audit findings are based on criteria and evidence, not on waiting for harm.",
        null
      ],
      "sourceTitle": "Safety Professional's Reference and Study Guide, 4th ed. (W. David Yates, CRC Press, 2025)",
      "sourceLocation": "Yates Chapter 37, documentation, employee interviews, and site conditions, pp. 818-843",
      "sourceUrls": [
        "https://doi.org/10.1201/9781003511786"
      ],
      "sourceVerifiedOn": "2026-08-26",
      "formula": null,
      "units": null,
      "reviewStatus": "ready",
      "verificationStatus": "source-checked",
      "authoringOrigin": "ai-assisted",
      "contentValidationStatus": "passed",
      "duplicateSimilarityCheckStatus": "passed",
      "contentFingerprint": "2b7553d48c0e2bb84b50c81920d084490f32d407249244172bae953e33ee027c"
    },
    {
      "id": "PV2-CH37-004",
      "version": 1,
      "chapterId": "ch-37",
      "chapterTitle": "Safety Program Auditing",
      "examAlignments": [
        "ASP",
        "CSP"
      ],
      "blueprintMappings": [
        {
          "credential": "ASP",
          "blueprintVersion": "ASP11",
          "objectiveId": "ASP11-A2.10",
          "role": "primary"
        },
        {
          "credential": "CSP",
          "blueprintVersion": "CSP11",
          "objectiveId": "CSP11-D2.08",
          "role": "secondary"
        }
      ],
      "concept": "Audit sampling",
      "itemFamilyId": "CH37-SAMPLING-01",
      "questionType": "single-best-answer",
      "cognitiveLevel": "analyze",
      "stem": "A multisite audit examines only one high-performing location selected by management. What is the primary weakness?",
      "options": [
        "The sample is unlikely to represent the organization and may bias the conclusion",
        "Every audit must inspect every record and location",
        "High-performing sites cannot provide any useful evidence",
        "Sampling is prohibited in management-system audits"
      ],
      "correctOptionIndex": 0,
      "correctAnswerExplanation": "Risk-based and representative sampling reduces selection bias and supports a defensible conclusion within the stated scope.",
      "incorrectOptionExplanations": [
        null,
        "Audits commonly sample, but the sample must be appropriate to objectives and risk.",
        "Strong sites can provide evidence, but they should not be the only management-selected sample.",
        "Sampling is a normal audit technique when limitations are understood."
      ],
      "sourceTitle": "Safety Professional's Reference and Study Guide, 4th ed. (W. David Yates, CRC Press, 2025)",
      "sourceLocation": "Yates Chapter 37, audit methodology and worksite analysis, pp. 818-839",
      "sourceUrls": [
        "https://doi.org/10.1201/9781003511786"
      ],
      "sourceVerifiedOn": "2026-08-26",
      "formula": null,
      "units": null,
      "reviewStatus": "ready",
      "verificationStatus": "source-checked",
      "authoringOrigin": "ai-assisted",
      "contentValidationStatus": "passed",
      "duplicateSimilarityCheckStatus": "passed",
      "contentFingerprint": "aea9628a3b9a86b9169f5cb1d4f5d3f745e73eec3eff6c47ccb38ce55caeeb40"
    },
    {
      "id": "PV2-CH37-005",
      "version": 1,
      "chapterId": "ch-37",
      "chapterTitle": "Safety Program Auditing",
      "examAlignments": [
        "ASP",
        "CSP"
      ],
      "blueprintMappings": [
        {
          "credential": "ASP",
          "blueprintVersion": "ASP11",